[
  {"id":"DORA-GADGET-0001","name_ko":"대나무 헬리콥터","name_jp":"タケコプター","name_en":"Take-copter","aliases":[],"summary":"착용자가 공중을 자유롭게 이동하도록 하는 소형 비행 도구.","media_origin":["manga"],"categories":["transportation","flight"],"capabilities":["vertical_takeoff","hover","3d_movement"],"sources":[],"engineering":{"analyzed":false,"feasibility":null,"project_id":null}},
  {"id":"DORA-GADGET-0002","name_ko":"어디로든 문","name_jp":"どこでもドア","name_en":"Anywhere Door","aliases":[],"summary":"목적지를 지정해 문을 열면 해당 장소와 즉시 연결되는 이동 도구.","media_origin":["manga"],"categories":["transportation","space"],"capabilities":["instant_travel","spatial_connection"],"sources":[],"engineering":{"analyzed":false,"feasibility":null,"project_id":null}},
  {"id":"DORA-GADGET-0003","name_ko":"타임머신","name_jp":"タイムマシン","name_en":"Time Machine","aliases":[],"summary":"시간축을 따라 과거와 미래로 이동하는 장치.","media_origin":["manga"],"categories":["transportation","time"],"capabilities":["time_travel"],"sources":[],"engineering":{"analyzed":false,"feasibility":null,"project_id":null}},
  {"id":"DORA-GADGET-0004","name_ko":"타임보자기","name_jp":"タイムふろしき","name_en":"Time Cloth","aliases":[],"summary":"덮은 대상의 상태를 과거 또는 미래 방향으로 변화시키는 천 형태의 도구.","media_origin":["manga"],"categories":["time","matter"],"capabilities":["state_reversal","state_acceleration"],"sources":[],"engineering":{"analyzed":false,"feasibility":null,"project_id":null}},
  {"id":"DORA-GADGET-0005","name_ko":"스몰라이트","name_jp":"スモールライト","name_en":"Small Light","aliases":[],"summary":"빛을 비춘 대상을 축소시키는 손전등형 도구.","media_origin":["manga"],"categories":["matter","size"],"capabilities":["shrink_object"],"sources":[],"engineering":{"analyzed":false,"feasibility":null,"project_id":null}},
  {"id":"DORA-GADGET-0006","name_ko":"빅라이트","name_jp":"ビッグライト","name_en":"Big Light","aliases":[],"summary":"빛을 비춘 대상을 확대시키는 손전등형 도구.","media_origin":["manga"],"categories":["matter","size"],"capabilities":["enlarge_object"],"sources":[],"engineering":{"analyzed":false,"feasibility":null,"project_id":null}},
  {"id":"DORA-GADGET-0007","name_ko":"암기빵","name_jp":"アンキパン","name_en":"Memory Bread","aliases":["Memorization Bread"],"summary":"글이나 정보를 빵에 복사해 먹으면 그 내용을 기억하게 하는 도구.","media_origin":["manga"],"categories":["brain","learning"],"capabilities":["memory_transfer","learning"],"sources":[],"engineering":{"analyzed":false,"feasibility":null,"project_id":null}},
  {"id":"DORA-GADGET-0008","name_ko":"투명망토","name_jp":"とうめいマント","name_en":"Invisible Cape","aliases":["Invisibility Cloak"],"summary":"착용자 또는 덮은 대상을 외부에서 보이지 않게 하는 망토.","media_origin":["manga"],"categories":["optics","camouflage"],"capabilities":["invisibility"],"sources":[],"engineering":{"analyzed":false,"feasibility":null,"project_id":null}},
  {"id":"DORA-GADGET-0009","name_ko":"적응등","name_jp":"テキオー灯","name_en":"Adaptation Light","aliases":[],"summary":"대상이 특정 환경에서 생존할 수 있도록 신체 상태를 적응시키는 빛.","media_origin":["manga"],"categories":["biology","environment"],"capabilities":["environmental_adaptation"],"sources":[],"engineering":{"analyzed":false,"feasibility":null,"project_id":null}},
  {"id":"DORA-GADGET-0010","name_ko":"공기포","name_jp":"空気砲","name_en":"Air Cannon","aliases":[],"summary":"압축된 공기 충격을 전방으로 발사하는 팔 장착형 도구.","media_origin":["manga"],"categories":["air","projectile"],"capabilities":["air_blast"],"sources":[],"engineering":{"analyzed":false,"feasibility":null,"project_id":null}},
  {"id":"DORA-GADGET-0011","name_ko":"공기권총","name_jp":"空気ピストル","name_en":"Air Pistol","aliases":[],"summary":"손가락 방향으로 공기성 충격을 발사하는 소형 도구.","media_origin":["manga"],"categories":["air","projectile"],"capabilities":["air_blast"],"sources":[],"engineering":{"analyzed":false,"feasibility":null,"project_id":null}},
  {"id":"DORA-GADGET-0012","name_ko":"4차원 주머니","name_jp":"四次元ポケット","name_en":"4D Pocket","aliases":["Fourth Dimensional Pocket"],"summary":"외형보다 훨씬 큰 공간에 수많은 물건을 저장하고 꺼낼 수 있는 주머니.","media_origin":["manga"],"categories":["space","storage"],"capabilities":["high_capacity_storage","spatial_storage"],"sources":[],"engineering":{"analyzed":false,"feasibility":null,"project_id":null}},
  {"id":"DORA-GADGET-0013","name_ko":"만약에 박스","name_jp":"もしもボックス","name_en":"What-If Phone Booth","aliases":["Moshimo Box"],"summary":"가정한 조건이 성립하는 세계를 체험하도록 만드는 전화박스형 도구.","media_origin":["manga"],"categories":["reality","simulation"],"capabilities":["alternate_world"],"sources":[],"engineering":{"analyzed":false,"feasibility":null,"project_id":null}},
  {"id":"DORA-GADGET-0014","name_ko":"통역곤약","name_jp":"ほんやくコンニャク","name_en":"Translation Konjac","aliases":[],"summary":"먹은 사람이 다른 언어를 이해하고 대화할 수 있게 하는 음식형 번역 도구.","media_origin":["manga"],"categories":["language","communication"],"capabilities":["translation","speech_understanding"],"sources":[],"engineering":{"analyzed":false,"feasibility":null,"project_id":null}},
  {"id":"DORA-GADGET-0015","name_ko":"갈리버 터널","name_jp":"ガリバートンネル","name_en":"Gulliver Tunnel","aliases":[],"summary":"통과 방향에 따라 사람이나 물체의 크기를 변화시키는 터널.","media_origin":["manga"],"categories":["matter","size"],"capabilities":["shrink_object","restore_size"],"sources":[],"engineering":{"analyzed":false,"feasibility":null,"project_id":null}},
  {"id":"DORA-GADGET-0016","name_ko":"복사거울","name_jp":"フエルミラー","name_en":"Multiplying Mirror","aliases":[],"summary":"거울에 비친 물건과 같은 물체를 만들어내는 도구.","media_origin":["manga"],"categories":["matter","replication"],"capabilities":["object_replication"],"sources":[],"engineering":{"analyzed":false,"feasibility":null,"project_id":null}},
  {"id":"DORA-GADGET-0017","name_ko":"독재자 스위치","name_jp":"どくさいスイッチ","name_en":"Dictator Switch","aliases":[],"summary":"특정 인물을 세상에서 사라진 것처럼 만드는 스위치형 도구.","media_origin":["manga"],"categories":["reality","social"],"capabilities":["target_erasure"],"sources":[],"engineering":{"analyzed":false,"feasibility":null,"project_id":null}},
  {"id":"DORA-GADGET-0018","name_ko":"타임 TV","name_jp":"タイムテレビ","name_en":"Time TV","aliases":[],"summary":"특정 장소의 과거나 미래 모습을 화면으로 관찰하는 장치.","media_origin":["manga"],"categories":["time","observation"],"capabilities":["past_observation","future_observation"],"sources":[],"engineering":{"analyzed":false,"feasibility":null,"project_id":null}},
  {"id":"DORA-GADGET-0019","name_ko":"어디로든 대포","name_jp":"どこでも大ほう","name_en":"Anywhere Cannon","aliases":[],"summary":"사람을 지정한 목적지 방향으로 이동시키는 대포형 이동 도구.","media_origin":["manga"],"categories":["transportation"],"capabilities":["long_distance_transport"],"sources":[],"engineering":{"analyzed":false,"feasibility":null,"project_id":null}},
  {"id":"DORA-GADGET-0020","name_ko":"올마이티 패스","name_jp":"オールマイティーパス","name_en":"Almighty Pass","aliases":[],"summary":"제시하면 제한된 장소도 통과할 수 있게 되는 패스.","media_origin":["manga"],"categories":["access","social"],"capabilities":["access_override"],"sources":[],"engineering":{"analyzed":false,"feasibility":null,"project_id":null}}
]
